Unnamed: 0,STATE/UT,DISTRICT,Year,Complain,Risk Level
6921,KARNATAKA,BELGAUM,2010,wife humiliated during family dinners,Medium
6922,KARNATAKA,BELLARY,2010,husband insulted wife constantly in public,Low
6923,KARNATAKA,BIDAR,2010,wife excluded from discussions at home,Medium
6924,KARNATAKA,BIJAPUR,2010,husband insulted wife unfairly at holidays,Low
6925,KARNATAKA,CBPURA,2010,wife humiliated daily without relief,Medium
6926,KARNATAKA,CHAMARAJNAGAR,2010,husband insulted wife about her looks constantly,Low
6927,KARNATAKA,CHICKMAGALUR,2010,wife excluded from neighborhood events,Medium
6928,KARNATAKA,CHITRADURGA,2010,husband insulted wife at community meetings,Low
6929,KARNATAKA,DAKSHIN KANNADA,2010,wife humiliated harshly at home,Medium
6930,KARNATAKA,DAVANAGERE,2010,husband insulted wife unfairly at church,Low
6931,KARNATAKA,DHARWAD COMMR.,2010,wife excluded from family respect,Medium
6932,KARNATAKA,DHARWAD RURAL,2010,husband insulted wife cruelly at work events,Low
6933,KARNATAKA,GADAG,2010,wife humiliated repeatedly without cause,Medium
6934,KARNATAKA,GULBARGA,2010,husband insulted wife daily in the morning,Low
6935,KARNATAKA,HASSAN,2010,wife excluded from evening gatherings,Medium
6936,KARNATAKA,HAVERI,2010,husband insulted wife harshly at lunch,Low
6937,KARNATAKA,K.G.F.,2010,wife humiliated at dinner daily,Medium
6938,KARNATAKA,KODAGU,2010,husband insulted wife cruelly at night,Low
6939,KARNATAKA,KOLAR,2010,wife excluded from family outings daily,Medium
6940,KARNATAKA,KOPPAL,2010,husband insulted wife again during visits,Low
6941,KARNATAKA,MANDYA,2010,wife humiliated endlessly without mercy,Medium
6942,KARNATAKA,MYSORE COMMR.,2010,husband insulted wife unfairly at family talks,Low
6943,KARNATAKA,MYSORE RURAL,2010,wife excluded from birthday parties,Medium
6944,KARNATAKA,RAICHUR,2010,husband insulted wife brutally during meals,Low
6945,KARNATAKA,RAILWAYS,2010,wife humiliated unfairly at every gathering,Medium
6946,KARNATAKA,RAMANAGAR,2010,husband insulted wife cruelly at family events,Low
6947,KARNATAKA,SHIMOGA,2010,wife excluded from every joyful event,Medium
6948,KARNATAKA,TUMKUR,2010,husband insulted wife again during discussions,Low
6949,KARNATAKA,UDUPI,2010,wife humiliated at every festival,Medium
6950,KARNATAKA,UTTAR KANNADA,2010,husband insulted wife unfairly at outings,Low
6951,KARNATAKA,YADGIRI,2010,wife excluded from financial control,Medium
6952,KARNATAKA,TOTAL,2010,husband insulted wife cruelly when angry,Low
6953,KERALA,ALAPUZHA,2010,wife humiliated constantly in gatherings,Medium
6954,KERALA,ERNAKULAM COMMR.,2010,husband insulted wife daily in front of friends,Low
6955,KERALA,ERNAKULAM RURAL,2010,wife excluded from property documents,Medium
6956,KERALA,IDUKKI,2010,husband insulted wife during visits daily,Low
6957,KERALA,KANNUR,2010,wife humiliated harshly in private,Medium
6958,KERALA,KASARGOD,2010,husband insulted wife unfairly before relatives,Low
6959,KERALA,KOLLAM,2010,wife excluded from her salary,Medium
6960,KERALA,KOTTAYAM,2010,husband insulted wife cruelly during arguments,Low
6961,KERALA,KOZHIKODE COMMR.,2010,wife humiliated repeatedly in gatherings,Medium
6962,KERALA,KOZHIKODE RURAL,2010,husband insulted wife daily before neighbors,Low
6963,KERALA,MALAPPURAM,2010,wife excluded from family conversations daily,Medium
6964,KERALA,PALAKKAD,2010,husband insulted wife in front of children daily,Low
6965,KERALA,PATHANAMTHITTA,2010,wife humiliated unfairly with harsh words,Medium
6966,KERALA,RAILWAYS,2010,husband insulted wife at every meal,Low
6967,KERALA,THRISSUR,2010,wife excluded from home decisions daily,Medium
6968,KERALA,TRIVANDRUM COMMR.,2010,husband insulted wife cruelly in gatherings daily,Low
6969,KERALA,TRIVANDRUM RURAL,2010,wife humiliated endlessly in private,Medium
6970,KERALA,WAYANADU,2010,husband insulted wife daily during chores,Low
6971,KERALA,TOTAL,2010,wife excluded from family occasions constantly,Medium
6972,MADHYA PRADESH,ALIRAJPUR,2010,husband insulted wife unfairly with insults,Low
6973,MADHYA PRADESH,ANUPPUR,2010,wife humiliated constantly in front of family,Medium
6974,MADHYA PRADESH,ASHOK NAGAR,2010,husband insulted wife again daily,Low
6975,MADHYA PRADESH,BALAGHAT,2010,wife excluded from her freedom daily,Medium
6976,MADHYA PRADESH,BARWANI,2010,husband insulted wife brutally in private,Low
6977,MADHYA PRADESH,BETUL,2010,wife humiliated during home gatherings,Medium
6978,MADHYA PRADESH,BHIND,2010,husband insulted wife harshly without pause,Low
6979,MADHYA PRADESH,BHOPAL,2010,wife excluded from important talks daily,Medium
6980,MADHYA PRADESH,BHOPAL RLY.,2010,husband insulted wife daily with shouting,Low
6981,MADHYA PRADESH,BURHANPUR,2010,wife humiliated repeatedly every night,Medium
6982,MADHYA PRADESH,CHHATARPUR,2010,husband insulted wife cruelly during meals daily,Low
6983,MADHYA PRADESH,CHHINDWARA,2010,wife excluded from family life constantly,Medium
6984,MADHYA PRADESH,DAMOH,2010,husband insulted wife daily in gatherings,Low
6985,MADHYA PRADESH,DATIYA,2010,wife humiliated endlessly every day,Medium
6986,MADHYA PRADESH,DEWAS,2010,husband shouted at wife during arguments daily,Low
6987,MADHYA PRADESH,DHAR,2010,wife humiliated at every social event,Medium
6988,MADHYA PRADESH,DINDORI,2010,husband insulted wife repeatedly in front of family,Low
6989,MADHYA PRADESH,GUNA,2010,wife denied her freedom every day,Medium
6990,MADHYA PRADESH,GWALIOR,2010,husband insulted wife at morning breakfast,Low
6991,MADHYA PRADESH,HARDA,2010,wife humiliated during community meetings,Medium
6992,MADHYA PRADESH,HOSHANGABAD,2010,husband insulted wife cruelly in front of neighbors,Low
6993,MADHYA PRADESH,INDORE,2010,wife excluded from family planning talks,Medium
6994,MADHYA PRADESH,INDORE RLY.,2010,husband insulted wife daily at gatherings,Low
6995,MADHYA PRADESH,JABALPUR,2010,wife humiliated with constant insults,Medium
6996,MADHYA PRADESH,JABALPUR RLY.,2010,husband insulted wife harshly at home daily,Low
6997,MADHYA PRADESH,JHABUA,2010,wife excluded from speaking freely,Medium
6998,MADHYA PRADESH,KATNI,2010,husband insulted wife unfairly in front of relatives,Low
6999,MADHYA PRADESH,KHANDWA,2010,wife humiliated repeatedly every day,Medium
7000,MADHYA PRADESH,KHARGON,2010,husband insulted wife cruelly when guests visited,Low
7001,MADHYA PRADESH,MANDLA,2010,wife excluded from decisions on spending money,Medium
7002,MADHYA PRADESH,MANDSAUR,2010,husband insulted wife daily in front of children,Low
7003,MADHYA PRADESH,MORENA,2010,wife humiliated unfairly at home,Medium
7004,MADHYA PRADESH,NARSINGHPUR,2010,husband insulted wife again during dinner,Low
7005,MADHYA PRADESH,NEEMUCH,2010,wife excluded from financial choices daily,Medium
7006,MADHYA PRADESH,PANNA,2010,husband insulted wife at public gatherings,Low
7007,MADHYA PRADESH,RAISEN,2010,wife humiliated constantly without reason,Medium
7008,MADHYA PRADESH,RAJGARH,2010,husband insulted wife cruelly during parties,Low
7009,MADHYA PRADESH,RATLAM,2010,wife excluded from family celebrations,Medium
7010,MADHYA PRADESH,REWA,2010,husband insulted wife daily in social events,Low
7011,MADHYA PRADESH,SAGAR,2010,wife humiliated with angry shouting,Medium
7012,MADHYA PRADESH,SATNA,2010,husband insulted wife harshly at community events,Low
7013,MADHYA PRADESH,SEONI,2010,wife excluded from her own life decisions,Medium
7014,MADHYA PRADESH,SHAHDOL,2010,husband insulted wife unfairly during ceremonies,Low
7015,MADHYA PRADESH,SHAJAPUR,2010,wife humiliated every morning by insults,Medium
7016,MADHYA PRADESH,SHEOPUR,2010,husband insulted wife cruelly during holidays,Low
7017,MADHYA PRADESH,SHIVPURI,2010,wife excluded from important events daily,Medium
7018,MADHYA PRADESH,SIDHI,2010,husband insulted wife daily in private arguments,Low
7019,MADHYA PRADESH,SIHORE,2010,wife humiliated endlessly without relief,Medium
7020,MADHYA PRADESH,SINGRAULI,2010,husband insulted wife harshly during gatherings,Low
7021,MADHYA PRADESH,TIKAMGARH,2010,wife excluded from family happiness,Medium
7022,MADHYA PRADESH,UJJAIN,2010,husband insulted wife unfairly at meals daily,Low
7023,MADHYA PRADESH,UMARIYA,2010,wife humiliated every night with shouting,Medium
7024,MADHYA PRADESH,VIDISHA,2010,husband insulted wife cruelly at church,Low
7025,MADHYA PRADESH,TOTAL,2010,wife excluded from household discussions daily,Medium
7026,MAHARASHTRA,AHMEDNAGAR,2010,husband insulted wife daily with no reason,Low
7027,MAHARASHTRA,AKOLA,2010,wife humiliated with loud insults,Medium
7028,MAHARASHTRA,AMRAVATI COMMR.,2010,husband insulted wife harshly every morning,Low
7029,MAHARASHTRA,AMRAVATI RURAL,2010,wife excluded from property rights daily,Medium
7030,MAHARASHTRA,AURANGABAD COMMR.,2010,husband insulted wife cruelly at breakfast,Low
7031,MAHARASHTRA,AURANGABAD RURAL,2010,wife humiliated daily at lunch,Medium
7032,MAHARASHTRA,BEED,2010,husband insulted wife unfairly during family visits,Low
7033,MAHARASHTRA,BHANDARA,2010,wife excluded from social respect,Medium
7034,MAHARASHTRA,BULDHANA,2010,husband insulted wife daily in public places,Low
7035,MAHARASHTRA,CHANDRAPUR,2010,wife humiliated constantly at home,Medium
7036,MAHARASHTRA,DHULE,2010,husband insulted wife harshly during dinner,Low
7037,MAHARASHTRA,GADCHIROLI,2010,wife excluded from gatherings regularly,Medium
7038,MAHARASHTRA,GONDIA,2010,husband insulted wife unfairly at parties,Low
7039,MAHARASHTRA,HINGOLI,2010,wife humiliated at evening meals,Medium
7040,MAHARASHTRA,JALGAON,2010,husband insulted wife cruelly at social events,Low
7041,MAHARASHTRA,JALNA,2010,wife excluded from family outings regularly,Medium
7042,MAHARASHTRA,KOLHAPUR,2010,husband insulted wife daily at celebrations,Low
7043,MAHARASHTRA,LATUR,2010,wife humiliated without cause every day,Medium
7044,MAHARASHTRA,MUMBAI COMMR.,2010,husband insulted wife harshly during visits,Low
7045,MAHARASHTRA,MUMBAI RLY.,2010,wife excluded from her freedom to speak,Medium
7046,MAHARASHTRA,NAGPUR COMMR.,2010,husband insulted wife unfairly at dinners,Low
7047,MAHARASHTRA,NAGPUR RLY.,2010,wife humiliated constantly in front of relatives,Medium
7048,MAHARASHTRA,NAGPUR RURAL,2010,husband insulted wife daily with abusive words,Low
7049,MAHARASHTRA,NANDED,2010,wife excluded from decision making always,Medium
7050,MAHARASHTRA,NANDURBAR,2010,husband insulted wife cruelly during meetings,Low
7051,MAHARASHTRA,NASIK COMMR.,2010,wife humiliated harshly every evening,Medium
7052,MAHARASHTRA,NASIK RURAL,2010,husband insulted wife unfairly during holidays,Low
7053,MAHARASHTRA,NAVI MUMBAI,2010,wife excluded from discussions with family,Medium
7054,MAHARASHTRA,OSMANABAD,2010,husband insulted wife daily in social circles,Low
7055,MAHARASHTRA,PARBHANI,2010,wife humiliated endlessly during meals,Medium
7056,MAHARASHTRA,PUNE COMMR.,2010,husband insulted wife harshly at public dinners,Low
7057,MAHARASHTRA,PUNE RLY.,2010,wife excluded from her personal rights,Medium
7058,MAHARASHTRA,PUNE RURAL,2010,husband insulted wife unfairly in gatherings,Low
7059,MAHARASHTRA,RAIGAD,2010,wife humiliated at every outing,Medium
7060,MAHARASHTRA,RATNAGIRI,2010,husband insulted wife daily at family dinners,Low
7061,MAHARASHTRA,SANGLI,2010,wife excluded from all choices,Medium
7062,MAHARASHTRA,SATARA,2010,husband insulted wife cruelly when angry daily,Low
7063,MAHARASHTRA,SINDHUDURG,2010,wife humiliated unfairly at celebrations,Medium
7064,MAHARASHTRA,SOLAPUR COMMR.,2010,husband insulted wife harshly during special days,Low
7065,MAHARASHTRA,SOLAPUR RURAL,2010,wife excluded from her own marriage life,Medium
7066,MAHARASHTRA,THANE COMMR.,2010,husband insulted wife daily at parties,Low
7067,MAHARASHTRA,THANE RURAL,2010,wife humiliated harshly in private rooms,Medium
7068,MAHARASHTRA,WARDHA,2010,husband insulted wife unfairly in public,Low
7069,MAHARASHTRA,WASHIM,2010,wife excluded from decisions constantly,Medium
7070,MAHARASHTRA,YAVATMAL,2010,husband insulted wife daily during chores,Low
7071,MAHARASHTRA,TOTAL,2010,wife humiliated constantly at gatherings,Medium
7072,MANIPUR,BISHNUPUR,2010,husband insulted wife cruelly during dinners,Low
7073,MANIPUR,CHANDEL,2010,wife excluded from social activities daily,Medium
7074,MANIPUR,CHURACHANDPUR,2010,husband insulted wife unfairly with harsh words,Low
7075,MANIPUR,CID,2010,wife humiliated endlessly at events,Medium
7076,MANIPUR,IMPHAL EAST,2010,husband insulted wife daily harshly at home,Low
7077,MANIPUR,IMPHAL WEST,2010,wife excluded from joyful moments,Medium
7078,MANIPUR,SENAPATI,2010,husband insulted wife unfairly every morning,Low
7079,MANIPUR,TAMENGLONG,2010,wife humiliated in front of relatives often,Medium
7080,MANIPUR,THOUBAL,2010,husband insulted wife cruelly with shouting,Low
7081,MANIPUR,UKHRUL,2010,wife excluded from family outings always,Medium
7082,MANIPUR,TOTAL,2010,husband insulted wife daily at work events,Low
7083,MEGHALAYA,GARO HILLS EAST,2010,wife humiliated without kindness,Medium
7084,MEGHALAYA,GARO HILLS SOUTH,2010,husband insulted wife harshly in daily life,Low
7085,MEGHALAYA,GARO HILLS WEST,2010,wife excluded from community gatherings,Medium
7086,MEGHALAYA,JAINTIA HILLS,2010,husband insulted wife unfairly during evening meals,Low
7087,MEGHALAYA,KHASI HILLS EAST,2010,wife humiliated constantly at home events,Medium
7088,MEGHALAYA,KHASI HILLS WEST,2010,husband insulted wife cruelly every morning,Low
7089,MEGHALAYA,RI-BHOI,2010,wife excluded from speaking in family talks,Medium
7090,MEGHALAYA,TOTAL,2010,husband insulted wife daily during arguments,Low
7091,MIZORAM,AIZAWL,2010,wife humiliated with loud shouting daily,Medium
7092,MIZORAM,CHAMPHAI,2010,husband insulted wife unfairly in gatherings daily,Low
7093,MIZORAM,KOLASIB,2010,wife excluded from family conversations regularly,Medium
7094,MIZORAM,LAWNGTLAI,2010,husband insulted wife cruelly at holidays daily,Low
7095,MIZORAM,LUNGLEI,2010,wife humiliated in front of family constantly,Medium
7096,MIZORAM,MAMIT,2010,husband insulted wife daily about her looks,Low
7097,MIZORAM,SAIHA,2010,wife excluded from her own decisions daily,Medium
7098,MIZORAM,SERCHHIP,2010,husband insulted wife unfairly during chores,Low
7099,MIZORAM,TOTAL,2010,wife humiliated repeatedly every morning,Medium
7100,NAGALAND,DIMAPUR,2010,husband insulted wife cruelly during events daily,Low
7101,NAGALAND,KIPHIRE,2010,wife excluded from her rights constantly,Medium
7102,NAGALAND,KOHIMA,2010,husband insulted wife daily during evenings,Low
7103,NAGALAND,LONGLENG,2010,wife humiliated endlessly during celebrations,Medium
7104,NAGALAND,MOKOKCHUNG,2010,husband insulted wife harshly during outings,Low
7105,NAGALAND,MON,2010,wife excluded from home rights,Medium
7106,NAGALAND,PEREN,2010,husband insulted wife unfairly daily with words,Low
7107,NAGALAND,PHEK,2010,wife humiliated constantly during family meals,Medium
7108,NAGALAND,TUENSANG,2010,husband insulted wife cruelly in private every day,Low
7109,NAGALAND,WOKHA,2010,wife excluded from family gatherings always,Medium
7110,NAGALAND,ZUNHEBOTO,2010,husband insulted wife daily at meetings,Low
7111,NAGALAND,TOTAL,2010,wife humiliated harshly in arguments,Low
7112,ODISHA,ANGUL,2010,husband insulted wife unfairly during family visits,Low
7113,ODISHA,BALASORE,2010,wife excluded from personal choices daily,Medium
7114,ODISHA,BARAGARH,2010,husband insulted wife cruelly at morning meals,Low
7115,ODISHA,BERHAMPUR,2010,wife humiliated repeatedly with shouts,Medium
7116,ODISHA,BHADRAK,2010,husband insulted wife daily with verbal abuse,Low
7117,ODISHA,BOLANGIR,2010,wife excluded from household decisions,Medium
7118,ODISHA,BOUDH,2010,husband insulted wife unfairly during private talks,Low
7119,ODISHA,CUTTACK,2010,wife humiliated constantly with anger,Medium
7120,ODISHA,DCP BBSR,2010,husband insulted wife daily during gatherings,Low
7121,ODISHA,DCP CTC,2010,wife excluded from family joys,Medium
7122,ODISHA,DEOGARH,2010,husband insulted wife cruelly during lunch daily,Low
7123,ODISHA,DHENKANAL,2010,wife humiliated without pause,Medium
7124,ODISHA,GAJAPATI,2010,husband insulted wife daily in front of in-laws,Low
7125,ODISHA,GANJAM,2010,wife excluded from her respect daily,Medium
7126,ODISHA,JAGATSINGHPUR,2010,husband insulted wife unfairly at public events,Low
7127,ODISHA,JAJPUR,2010,wife humiliated continuously with yelling,Medium
7128,ODISHA,JHARSUGUDA,2010,husband insulted wife daily with cruel words,Low
7129,ODISHA,KALAHANDI,2010,wife excluded from evening family events,Medium
7130,ODISHA,KANDHAMAL,2010,husband insulted wife harshly daily without reason,Low
7131,ODISHA,KENDRAPARA,2010,wife humiliated every day during talks,Medium
7132,ODISHA,KEONJHAR,2010,husband insulted wife cruelly during dinners daily,Low
7133,ODISHA,KHURDA,2010,wife excluded from her own happiness,Medium
7134,ODISHA,KORAPUT,2010,husband insulted wife daily during household work,Low
7135,ODISHA,MALKANGIR,2010,wife humiliated constantly at social events,Medium
7136,ODISHA,MAYURBHANJ,2010,husband insulted wife unfairly during outings,Low
7137,ODISHA,NAYAGARH,2010,wife excluded from decisions at home daily,Medium
7138,ODISHA,NOWRANGPUR,2010,husband insulted wife daily at celebrations,Low
7139,ODISHA,NUAPADA,2010,wife humiliated endlessly every week,Medium
7140,ODISHA,PURI,2010,husband insulted wife harshly in front of family daily,Low
7141,ODISHA,RAYAGADA,2010,wife excluded from joyful gatherings,Medium
7142,ODISHA,ROURKELA,2010,husband insulted wife unfairly every evening,Low
7143,ODISHA,SAMBALPUR,2010,wife humiliated daily at public places,Medium
7144,ODISHA,SONEPUR,2010,husband insulted wife cruelly in family life,Low
7145,ODISHA,SRP(CUTTACK),2010,wife excluded from every activity,Medium
7146,ODISHA,SRP(ROURKELA),2010,husband insulted wife daily during meals,Low
7147,ODISHA,SUNDARGARH,2010,wife humiliated constantly by harsh words,Medium
7148,ODISHA,TOTAL,2010,husband insulted wife unfairly at home constantly,Low
7149,PUNJAB,AMRITSAR RURAL,2010,wife excluded from freedom of choice,Medium
7150,PUNJAB,BARNALA,2010,husband insulted wife daily without reason,Low
7151,PUNJAB,BATALA,2010,wife humiliated endlessly in gatherings,Medium
7152,PUNJAB,BHATINDA,2010,husband insulted wife cruelly at parties daily,Low
7153,PUNJAB,CP AMRITSAR,2010,wife excluded from home talks always,Medium
7154,PUNJAB,CP JALANDHAR,2010,husband insulted wife daily in ceremonies,Low
7155,PUNJAB,CP LUDHIANA,2010,wife humiliated without mercy every day,Medium
7156,PUNJAB,FARIDKOT,2010,husband insulted wife unfairly in front of guests,Low
7157,PUNJAB,FATEHGARH SAHIB,2010,wife excluded from social events daily,Medium
7158,PUNJAB,FEROZPUR,2010,husband insulted wife daily harshly in meetings,Low
7159,PUNJAB,G.R.P,2010,wife humiliated constantly in family life,Medium
7160,PUNJAB,GURDASPUR,2010,husband insulted wife cruelly in front of friends,Low
7161,PUNJAB,HOSHIARPUR,2010,wife excluded from joyful experiences daily,Medium
7162,PUNJAB,JALANDHAR RURAL,2010,husband insulted wife unfairly during lunch,Low
7163,PUNJAB,KAPURTHALA,2010,wife humiliated daily during chores,Medium
7164,PUNJAB,KHANNA,2010,husband insulted wife daily about her habits,Low
7165,PUNJAB,LUDHIANA RURAL,2010,wife excluded from household rights,Medium
7166,PUNJAB,MANSA,2010,husband insulted wife cruelly at gatherings daily,Low
7167,PUNJAB,MOGA,2010,wife humiliated constantly at private talks,Medium
7168,PUNJAB,MUKTSAR,2010,husband insulted wife daily with verbal violence,High
7169,PUNJAB,PATIALA,2010,wife excluded from family joy daily,Medium
7170,PUNJAB,ROPAR,2010,husband insulted wife unfairly at morning meals,Low
7171,PUNJAB,SANGRUR,2010,wife humiliated repeatedly at parties,Medium
7172,PUNJAB,SAS NGR,2010,husband insulted wife daily during celebrations,Low
7173,PUNJAB,SBS NAGAR,2010,wife excluded from decisions with family daily,Medium
7174,PUNJAB,TARN TARAN,2010,husband insulted wife cruelly in front of relatives daily,Low
7175,PUNJAB,TOTAL,2010,wife humiliated endlessly without kindness,Medium
7176,RAJASTHAN,AJMER,2010,husband insulted wife daily during breakfast,Low
7177,RAJASTHAN,ALWAR,2010,wife excluded from important matters daily,Medium
7178,RAJASTHAN,BANSWARA,2010,husband insulted wife unfairly in family events,Low
7179,RAJASTHAN,BARAN,2010,wife humiliated daily with angry shouting,Medium
7180,RAJASTHAN,BARMER,2010,husband insulted wife daily cruelly at night,Low
7181,RAJASTHAN,BHARATPUR,2010,wife excluded from family rights constantly,Medium
7182,RAJASTHAN,BHILWARA,2010,husband insulted wife daily harshly in gatherings,Low
7183,RAJASTHAN,BIKANER,2010,wife humiliated constantly during meals,Medium
7184,RAJASTHAN,BUNDI,2010,husband insulted wife unfairly every week,Low
7185,RAJASTHAN,CHITTORGARH,2010,wife excluded from personal talks daily,Medium
7186,RAJASTHAN,CHURU,2010,husband insulted wife daily cruelly in private,Low
7187,RAJASTHAN,DAUSA,2010,wife humiliated endlessly at social dinners,Medium
7188,RAJASTHAN,DHOLPUR,2010,husband insulted wife daily during family meetings,Low
7189,RAJASTHAN,DUNGARPUR,2010,wife excluded from her respect constantly,Medium
7190,RAJASTHAN,G.R.P. AJMER,2010,husband insulted wife unfairly every meal,Low
7191,RAJASTHAN,G.R.P. JODHPUR,2010,wife humiliated constantly in public daily,Medium
7192,RAJASTHAN,GANGANAGAR,2010,husband insulted wife daily harshly without reason,Low
7193,RAJASTHAN,HANUMANGARH,2010,wife excluded from family conversations daily,Medium
7194,RAJASTHAN,JAIPUR EAST,2010,husband insulted wife daily cruelly in gatherings,Low
7195,RAJASTHAN,JAIPUR NORTH,2010,wife humiliated daily at home constantly,Medium
7196,RAJASTHAN,JAIPUR RURAL,2010,husband insulted wife unfairly during functions,Low
7197,RAJASTHAN,JAIPUR SOUTH,2010,wife excluded from joyful family events daily,Medium
7198,RAJASTHAN,JAISALMER,2010,husband insulted wife daily harshly during meals,Low
7199,RAJASTHAN,JALORE,2010,wife humiliated endlessly during holidays,Medium
7200,RAJASTHAN,JHALAWAR,2010,husband insulted wife daily with harsh words,Low
7201,RAJASTHAN,JHUNJHUNU,2010,wife excluded from family gatherings constantly,Medium
7202,RAJASTHAN,JODHPUR CITY,2010,husband insulted wife unfairly at special occasions,Low
7203,RAJASTHAN,JODHPUR RURAL,2010,wife humiliated daily at celebrations,Medium
7204,RAJASTHAN,KARAULI,2010,husband insulted wife daily cruelly during outings,Low
7205,RAJASTHAN,KOTA CITY,2010,wife excluded from personal rights constantly,Medium
7206,RAJASTHAN,KOTA RURAL,2010,husband insulted wife daily harshly at holidays,Low
7207,RAJASTHAN,NAGAUR,2010,wife humiliated without kindness every day,Medium
7208,RAJASTHAN,PALI,2010,husband insulted wife daily unfairly in events,Low
7209,RAJASTHAN,PRATAPGARH,2010,wife excluded from family activities daily,Medium
7210,RAJASTHAN,RAJSAMAND,2010,husband insulted wife daily cruelly at home constantly,Low
7211,RAJASTHAN,SAWAI MADHOPUR,2010,wife humiliated daily during arguments,Low
7212,RAJASTHAN,SIKAR,2010,husband insulted wife daily harshly every evening,Low
7213,RAJASTHAN,SIROHI,2010,wife excluded from her freedom constantly,Medium
7214,RAJASTHAN,TONK,2010,husband insulted wife unfairly at community events,Low
7215,RAJASTHAN,UDAIPUR,2010,wife humiliated endlessly without rest,Medium
7216,RAJASTHAN,TOTAL,2010,husband insulted wife daily cruelly at every meal,Low
7217,SIKKIM,EAST,2010,wife excluded from property matters daily,Medium
7218,SIKKIM,NORTH,2010,husband insulted wife daily harshly without mercy,Low
7219,SIKKIM,SOUTH,2010,wife humiliated constantly with shouts,Medium
7220,SIKKIM,WEST,2010,husband insulted wife unfairly during private talks daily,Low
7221,SIKKIM,TOTAL,2010,wife excluded from joyful rights,Medium
7222,TAMIL NADU,ARIYALUR,2010,husband insulted wife daily cruelly during evenings,Low
7223,TAMIL NADU,CHENNAI,2010,wife humiliated endlessly during gatherings,Medium
7224,TAMIL NADU,CHENNAI RLY.,2010,husband insulted wife daily harshly at public places,Low
7225,TAMIL NADU,CHENNAISUBURBAN,2010,wife excluded from her own decisions constantly,Medium
7226,TAMIL NADU,COIMBATORE RURAL,2010,husband insulted wife unfairly every morning daily,Low
7227,TAMIL NADU,COIMBATORE URBAN,2010,wife humiliated daily at breakfast,Medium
7228,TAMIL NADU,CUDDALORE,2010,husband insulted wife daily cruelly in front of family,Low
7229,TAMIL NADU,DHARMAPURI,2010,wife excluded from holidays always,Medium
7230,TAMIL NADU,DINDIGUL,2010,husband insulted wife daily harshly during work events,Low
7231,TAMIL NADU,ERODE,2010,wife humiliated constantly at festivals,Medium
7232,TAMIL NADU,KANCHIPURAM,2010,husband insulted wife daily unfairly at dinners,Low
7233,TAMIL NADU,KANYAKUMARI,2010,wife excluded from family joys constantly,Medium
7234,TAMIL NADU,KARUR,2010,husband insulted wife daily cruelly with abusive words,Low
7235,TAMIL NADU,KRISHNAGIRI,2010,wife humiliated every day in front of relatives,Medium
7236,TAMIL NADU,MADURAI RURAL,2010,husband insulted wife daily harshly in private talks,Low
7237,TAMIL NADU,MADURAI URBAN,2010,wife excluded from household decisions constantly,Medium
7238,TAMIL NADU,NAGAPATTINAM,2010,husband insulted wife daily unfairly during meetings,Low
7239,TAMIL NADU,NAMAKKAL,2010,wife humiliated endlessly at evening meals,Medium
7240,TAMIL NADU,NILGIRIS,2010,husband insulted wife daily cruelly at parties,Low
7241,TAMIL NADU,PERAMBALUR,2010,wife excluded from respect daily,Medium
7242,TAMIL NADU,PUDUKOTTAI,2010,husband insulted wife daily harshly at family talks,Low
7243,TAMIL NADU,RAMNATHAPURAM,2010,wife humiliated without reason in gatherings,Medium
7244,TAMIL NADU,SALEM RURAL,2010,husband insulted wife daily unfairly at outings,Low
7245,TAMIL NADU,SALEM URBAN,2010,wife excluded from every choice daily,Medium
7246,TAMIL NADU,SIVAGANGAI,2010,husband insulted wife daily cruelly during celebrations,Low
7247,TAMIL NADU,THANJAVUR,2010,wife humiliated daily with insults constantly,Medium
7248,TAMIL NADU,THENI,2010,husband insulted wife daily harshly in arguments daily,Low
7249,TAMIL NADU,THIRUNELVELI RURAL,2010,wife excluded from family freedom,Medium
