Unnamed: 0,STATE/UT,DISTRICT,Year,Complain,Risk Level
2083,UTTAR PRADESH,RAMPUR,2003,husband forced wife to quit her studies,Medium
2084,UTTAR PRADESH,SAHARANPUR,2003,husband excluded wife from work decisions,Medium
2085,UTTAR PRADESH,SANT KABIRNAGAR,2003,husband humiliated wife with sarcastic remarks,Medium
2086,UTTAR PRADESH,SHAHJAHANPUR,2003,husband insulted wife about her weight,Low
2087,UTTAR PRADESH,SHRAWASTI,2003,husband forced wife to stand for hours,Medium
2088,UTTAR PRADESH,SIDHARTHNAGAR,2003,husband excluded wife from social gatherings,Medium
2089,UTTAR PRADESH,SITAPUR,2003,husband humiliated wife at festivals,Medium
2090,UTTAR PRADESH,SONBHADRA,2003,husband insulted wife constantly without reason,Low
2091,UTTAR PRADESH,ST.RAVIDASNAGAR,2003,husband forced wife to sleep on the floor nightly,Medium
2092,UTTAR PRADESH,SULTANPUR,2003,husband excluded wife from family money matters,Medium
2093,UTTAR PRADESH,UNNAO,2003,husband humiliated wife in front of friends,Medium
2094,UTTAR PRADESH,VARANASI,2003,husband hit wife,High
2095,UTTAR PRADESH,TOTAL,2003,wife slapped by husband,Low
2096,UTTARAKHAND,ALMORA,2003,wife threatened with divorce,Medium
2097,UTTARAKHAND,BAGESHWAR,2003,wife insulted in public,Low
2098,UTTARAKHAND,CHAMOLI,2003,husband pushed wife during argument,Low
2099,UTTARAKHAND,CHAMPAWAT,2003,wife humiliated in front of family,Medium
2100,UTTARAKHAND,DEHRADUN,2003,partner shouted at wife,Medium
2101,UTTARAKHAND,HARIDWAR,2003,husband pulled wifes hair,Medium
2102,UTTARAKHAND,NAINITAL,2003,wife locked inside the room,Medium
2103,UTTARAKHAND,PAURI GARHWAL,2003,wife denied food by husband,Medium
2104,UTTARAKHAND,PITHORAGARH,2003,husband threw objects at wife,Medium
2105,UTTARAKHAND,RUDRA PRAYAG,2003,wife forced to hand over salary,Medium
2106,UTTARAKHAND,TEHRI GARHWAL,2003,husband accused wife without reason,Medium
2107,UTTARAKHAND,UDHAMSINGH NAGAR,2003,wife restricted from seeing family,Medium
2108,UTTARAKHAND,UTTARKASHI,2003,wife forced to quit job,Medium
2109,UTTARAKHAND,TOTAL,2003,wife denied healthcare by husband,Medium
2110,WEST BENGAL,24 PARGANAS NORTH,2003,partner broke wifes phone,Medium
2111,WEST BENGAL,24 PARGANAS SOUTH,2003,husband ignored wifes illness,Medium
2112,WEST BENGAL,ASANSOL,2003,wife forced into unwanted intimacy,Medium
2113,WEST BENGAL,BANKURA,2003,husband spread lies about wife,Medium
2114,WEST BENGAL,BIRBHUM,2003,wife excluded from family decisions,Medium
2115,WEST BENGAL,BURDWAN,2003,husband insulted wife daily,Low
2116,WEST BENGAL,COOCHBEHAR,2003,wife threatened with violence,High
2117,WEST BENGAL,DAKSHIN DINAJPUR,2003,husband destroyed wifes belongings,Medium
2118,WEST BENGAL,DARJEELING,2003,wife denied rest during pregnancy,Medium
2119,WEST BENGAL,HOOGHLY,2003,wife forced to obey husband blindly,Medium
2120,WEST BENGAL,HOWRAH,2003,husband controlled wifes movements,Medium
2121,WEST BENGAL,HOWRAH CITY,2003,wife silenced during argument,Low
2122,WEST BENGAL,HOWRAH G.R.P.,2003,husband checked wifes phone,Medium
2123,WEST BENGAL,JALPAIGURI,2003,wife forced to eat less,Medium
2124,WEST BENGAL,KHARAGPUR G.R.P.,2003,partner restricted wifes internet access,Medium
2125,WEST BENGAL,KOLKATA,2003,wife isolated from neighbors,Medium
2126,WEST BENGAL,MALDA,2003,husband criticized wifes cooking,Medium
2127,WEST BENGAL,MURSHIDABAD,2003,wife treated like servant,Medium
2128,WEST BENGAL,NADIA,2003,husband insulted wifes appearance,Low
2129,WEST BENGAL,PASCHIM MIDNAPUR,2003,wife denied access to money,Medium
2130,WEST BENGAL,PURAB MIDNAPUR,2003,husband forced wife to leave job,Medium
2131,WEST BENGAL,PURULIA,2003,wife accused of cheating without proof,Medium
2132,WEST BENGAL,SEALDAH G.R.P.,2003,husband insulted wife during family event,Low
2133,WEST BENGAL,SILIGURI G.R.P.,2003,wife forced to hand over documents,Medium
2134,WEST BENGAL,UTTAR DINAJPUR,2003,husband insulted wifes family,Low
2135,WEST BENGAL,TOTAL,2003,wife denied privacy,Medium
2136,A & N ISLANDS,ANDAMAN,2003,husband controlled every purchase,Medium
2137,A & N ISLANDS,NICOBAR,2003,wife locked outside house,Medium
2138,A & N ISLANDS,TOTAL,2003,husband forced wife to sleep separately,Medium
2139,CHANDIGARH,CHANDIGARH,2003,wife denied visits to parents,Medium
2140,CHANDIGARH,TOTAL,2003,husband used alcohol then abused wife,Medium
2141,D & N HAVELI,D and N HAVELI,2003,wife treated as inferior,Medium
2142,D & N HAVELI,TOTAL,2003,husband destroyed wifes clothes,Medium
2143,DAMAN & DIU,DAMAN,2003,wife blamed for financial problems,Medium
2144,DAMAN & DIU,DIU,2003,husband restricted wife from driving,Medium
2145,DAMAN & DIU,TOTAL,2003,wife ignored during illness,Medium
2146,DELHI,CENTRAL,2003,husband forced intimacy without consent,Medium
2147,DELHI,DELHI UT TOTAL,2003,wife insulted in front of children,Low
2148,DELHI,EAST,2003,husband ridiculed wife constantly,Medium
2149,DELHI,G.R.P.(RLY),2003,wife denied phone use,Medium
2150,DELHI,I.G.I. AIRPORT,2003,husband monitored wifes calls,Medium
2151,DELHI,NEW DELHI,2003,wife restricted from meeting friends,Medium
2152,DELHI,NORTH,2003,husband accused wife of laziness,Medium
2153,DELHI,NORTH EAST,2003,wife forced to beg for money,Medium
2154,DELHI,NORTH WEST,2003,husband threatened wife with weapon,Medium
2155,DELHI,S.T.F.,2003,wife shouted at daily,Medium
2156,DELHI,SOUTH,2003,husband ignored wife intentionally,Medium
2157,DELHI,SOUTH WEST,2003,wife blamed for everything,Medium
2158,DELHI,WEST,2003,husband criticized wifes body,Medium
2159,LAKSHADWEEP,LAKSHADWEEP,2003,wife threatened to be thrown out,Medium
2160,LAKSHADWEEP,TOTAL,2003,husband denied wife food,Medium
2161,PUDUCHERRY,PONDICHERRY,2003,wife controlled financially,Medium
2162,PUDUCHERRY,TOTAL,2003,husband forced wife to do hard work,Medium
2163,ANDHRA PRADESH,ADILABAD,2004,wife humiliated for mistakes,Medium
2164,ANDHRA PRADESH,ANANTAPUR,2004,husband forced wife to cook while sick,Medium
2165,ANDHRA PRADESH,CHITTOOR,2004,wife denied rest by husband,Medium
2166,ANDHRA PRADESH,CUDDAPAH,2004,husband insulted wife in front of others,Low
2167,ANDHRA PRADESH,CYBERABAD,2004,wife restricted from social life,Medium
2168,ANDHRA PRADESH,EAST GODAVARI,2004,husband checked wifes location,Medium
2169,ANDHRA PRADESH,GUNTAKAL RLY.,2004,wife excluded from celebrations,Medium
2170,ANDHRA PRADESH,GUNTUR,2004,husband used abusive language,Medium
2171,ANDHRA PRADESH,HYDERABAD CITY,2004,wife denied basic needs,Medium
2172,ANDHRA PRADESH,KARIMNAGAR,2004,husband insulted wifes dress,Low
2173,ANDHRA PRADESH,KHAMMAM,2004,wife blamed for husbands anger,Medium
2174,ANDHRA PRADESH,KRISHNA,2004,husband restricted wifes movements,Medium
2175,ANDHRA PRADESH,KURNOOL,2004,wife threatened to be abandoned,Medium
2176,ANDHRA PRADESH,MAHABOOBNAGAR,2004,husband accused wife without proof,Medium
2177,ANDHRA PRADESH,MEDAK,2004,wife forced to obey in silence,Medium
2178,ANDHRA PRADESH,NALGONDA,2004,husband pushed wife harshly,Low
2179,ANDHRA PRADESH,NELLORE,2004,wife forced to live in fear,Medium
2180,ANDHRA PRADESH,NIZAMABAD,2004,husband cursed wife daily,Medium
2181,ANDHRA PRADESH,PRAKASHAM,2004,wife humiliated during argument,Low
2182,ANDHRA PRADESH,RANGA REDDY,2004,husband ignored wifes opinions,Medium
2183,ANDHRA PRADESH,SECUNDERABAD RLY.,2004,wife blamed for household problems,Medium
2184,ANDHRA PRADESH,SRIKAKULAM,2004,husband accused wife of disrespect,Medium
2185,ANDHRA PRADESH,VIJAYAWADA,2004,wife forced to leave family events,Medium
2186,ANDHRA PRADESH,VIJAYAWADA RLY.,2004,husband insulted wife in front of guests,Low
2187,ANDHRA PRADESH,VISAKHA RURAL,2004,wife denied right to speak,Medium
2188,ANDHRA PRADESH,VISAKHAPATNAM,2004,husband forced wife to sign papers,Medium
2189,ANDHRA PRADESH,VIZIANAGARAM,2004,wife criticized unfairly,Medium
2190,ANDHRA PRADESH,WARANGAL,2004,husband made wife beg for money,Medium
2191,ANDHRA PRADESH,WEST GODAVARI,2004,wife denied freedom of speech,Medium
2192,ANDHRA PRADESH,TOTAL,2004,husband ignored wifes feelings,Medium
2193,ARUNACHAL PRADESH,CHANGLANG,2004,wife excluded from financial matters,Medium
2194,ARUNACHAL PRADESH,DIBANG VALLEY,2004,husband ridiculed wife in public,Medium
2195,ARUNACHAL PRADESH,K/KUMEY,2004,wife forced to wake early daily,Medium
2196,ARUNACHAL PRADESH,KAMENG EAST,2004,husband insulted wife repeatedly,Low
2197,ARUNACHAL PRADESH,KAMENG WEST,2004,wife denied personal time,Medium
2198,ARUNACHAL PRADESH,LOHIT,2004,husband restricted wifes bank account,Medium
2199,ARUNACHAL PRADESH,PAPUM PARE,2004,wife silenced by threats,Medium
2200,ARUNACHAL PRADESH,SIANG EAST,2004,husband insulted wifes relatives,Low
2201,ARUNACHAL PRADESH,SIANG UPPER,2004,wife treated without respect,Medium
2202,ARUNACHAL PRADESH,SIANG WEST,2004,husband controlled wifes daily life,Medium
2203,ARUNACHAL PRADESH,SUBANSIRI LOWER,2004,wife humiliated in front of relatives,Medium
2204,ARUNACHAL PRADESH,SUBANSIRI UPPER,2004,husband destroyed wifes belongings in anger,Medium
2205,ARUNACHAL PRADESH,TAWANG,2004,wife forced to accept blame,Medium
2206,ARUNACHAL PRADESH,TIRAP,2004,husband insulted wife in front of neighbors,Low
2207,ARUNACHAL PRADESH,UPPER DIBANG VALLEY,2004,wife denied her own money,Medium
2208,ARUNACHAL PRADESH,TOTAL,2004,husband insulted wifes cooking,Low
2209,ASSAM,BARPETA,2004,wife controlled through fear,Medium
2210,ASSAM,BONGAIGAON,2004,husband restricted wifes outings,Medium
2211,ASSAM,C.I.D.,2004,wife denied right to study,Medium
2212,ASSAM,CACHAR,2004,husband accused wife of betrayal,Medium
2213,ASSAM,DARRANG,2004,wife insulted in front of friends,Low
2214,ASSAM,DHEMAJI,2004,husband insulted wife during gatherings,Low
2215,ASSAM,DHUBRI,2004,wife forced to remain silent,Medium
2216,ASSAM,DIBRUGARH,2004,husband threatened wife with divorce constantly,Medium
2217,ASSAM,G.R.P.,2004,wife denied her salary,Medium
2218,ASSAM,GOALPARA,2004,husband ignored wife during pregnancy,Medium
2219,ASSAM,GOLAGHAT,2004,wife forced to stay at home,Medium
2220,ASSAM,GUWAHATI CITY,2004,husband insulted wifes body shape,Low
2221,ASSAM,HAILAKANDI,2004,wife accused without reason daily,Medium
2222,ASSAM,JORHAT,2004,husband forced wife to obey commands,Medium
2223,ASSAM,KAMRUP,2004,wife humiliated in public events,Medium
2224,ASSAM,KARBI ANGLONG,2004,husband shouted at wife daily,Medium
2225,ASSAM,KARIMGANJ,2004,wife denied access to health care,Medium
2226,ASSAM,KOKRAJHAR,2004,husband criticized wife harshly,Medium
2227,ASSAM,LAKHIMPUR,2004,wife blamed for husbands failures,Medium
2228,ASSAM,MORIGAON,2004,husband insulted wife in social media,Low
2229,ASSAM,N.C.HILLS,2004,wife forced to give up work,Medium
2230,ASSAM,NAGAON,2004,husband denied wifes needs,Medium
2231,ASSAM,NALBARI,2004,wife threatened with separation,Medium
2232,ASSAM,R.P.O.,2004,husband insulted wife during arguments,Low
2233,ASSAM,SIBSAGAR,2004,wife silenced by force,Medium
2234,ASSAM,SONITPUR,2004,husband insulted wife repeatedly in front of family,Low
2235,ASSAM,TINSUKIA,2004,wife denied any support,Medium
2236,ASSAM,TOTAL,2004,husband controlled wifes conversations,Medium
2237,BIHAR,ARARIA,2004,wife forced to follow orders,Medium
2238,BIHAR,ARWAL,2004,husband insulted wife in front of children,Low
2239,BIHAR,AURANGABAD,2004,wife excluded from family outings,Medium
2240,BIHAR,BAGAHA,2004,husband denied wife medical help,Medium
2241,BIHAR,BANKA,2004,wife forced into silence by threats,Medium
2242,BIHAR,BEGUSARAI,2004,husband ridiculed wifes intelligence,Medium
2243,BIHAR,BETTIAH,2004,wife treated like property,Medium
2244,BIHAR,BHABHUA,2004,husband insulted wife regularly,Low
2245,BIHAR,BHAGALPUR,2004,wife forced to give money daily,Medium
2246,BIHAR,BHOJPUR,2004,husband ignored wifes emotions,Medium
2247,BIHAR,BUXAR,2004,wife denied her opinion in decisions,Medium
2248,BIHAR,DARBHANGA,2004,husband humiliated wife in front of guests,Medium
2249,BIHAR,GAYA,2004,wife excluded from home decisions,Medium
2250,BIHAR,GOPALGANJ,2004,husband insulted wifes education,Low
2251,BIHAR,JAMALPUR RLY.,2004,wife denied freedom of movement,Medium
2252,BIHAR,JAMUI,2004,husband insulted wife during celebrations,Low
2253,BIHAR,JEHANABAD,2004,wife forced to accept insults,Medium
2254,BIHAR,KATIHAR,2004,husband insulted wife during meals,Low
2255,BIHAR,KATIHAR RLY.,2004,wife excluded from holidays,Medium
2256,BIHAR,KHAGARIA,2004,husband insulted wifes work,Low
2257,BIHAR,KISHANGANJ,2004,wife treated with constant disrespect,Medium
2258,BIHAR,LAKHISARAI,2004,husband insulted wife when angry,Low
2259,BIHAR,MADHEPURA,2004,wife denied rest and peace,Medium
2260,BIHAR,MADHUBANI,2004,husband insulted wife without reason,Low
2261,BIHAR,MOTIHARI,2004,wife excluded from social gatherings,Medium
2262,BIHAR,MUNGER,2004,husband ridiculed wifes efforts,Medium
2263,BIHAR,MUZAFFARPUR,2004,wife insulted for mistakes,Low
2264,BIHAR,MUZAFFARPUR RLY.,2004,husband insulted wife when drinking,Low
2265,BIHAR,NALANDA,2004,wife denied comfort at home,Medium
2266,BIHAR,NAUGACHIA,2004,husband insulted wife in community,Low
2267,BIHAR,NAWADAH,2004,wife excluded from choices,Medium
2268,BIHAR,PATNA,2004,husband insulted wifes dress daily,Low
2269,BIHAR,PATNA RLY.,2004,wife insulted during arguments,Low
2270,BIHAR,PURNEA,2004,husband insulted wifes opinions,Low
2271,BIHAR,ROHTAS,2004,wife treated like a burden,Medium
2272,BIHAR,SAHARSA,2004,husband insulted wife in front of friends,Low
2273,BIHAR,SAMASTIPUR,2004,wife denied happiness,Medium
2274,BIHAR,SARAN,2004,husband insulted wife publicly,Low
2275,BIHAR,SHEIKHPURA,2004,wife insulted during celebrations,Low
2276,BIHAR,SHEOHAR,2004,husband insulted wife constantly,Low
2277,BIHAR,SITAMARHI,2004,wife excluded from important matters,Medium
2278,BIHAR,SIWAN,2004,husband insulted wife with harsh words,Low
2279,BIHAR,SUPAUL,2004,wife insulted daily,Low
2280,BIHAR,VAISHALI,2004,husband insulted wife over small issues,Low
2281,BIHAR,TOTAL,2004,wife insulted in private,Low
2282,CHHATTISGARH,BALRAMPUR,2004,husband insulted wife in gatherings,Low
2283,CHHATTISGARH,BILASPUR,2004,wife insulted repeatedly,Low
2284,CHHATTISGARH,BIZAPUR,2004,husband insulted wife at home,Low
2285,CHHATTISGARH,DANTEWARA,2004,wife insulted unfairly,Low
2286,CHHATTISGARH,DHAMTARI,2004,husband insulted wife cruelly,Low
2287,CHHATTISGARH,DURG,2004,wife insulted harshly,Low
2288,CHHATTISGARH,GRP RAIPUR,2004,husband insulted wife again and again,Low
2289,CHHATTISGARH,JAGDALPUR,2004,wife insulted continuously,Low
2290,CHHATTISGARH,JANJGIR,2004,husband insulted wife endlessly,Low
2291,CHHATTISGARH,JASHPUR,2004,husband shouted at wife without reason,Medium
2292,CHHATTISGARH,KABIRDHAM,2004,wife denied financial independence,Medium
2293,CHHATTISGARH,KANKER,2004,husband insulted wifes family background,Low
2294,CHHATTISGARH,KORBA,2004,wife humiliated during social visit,Medium
2295,CHHATTISGARH,KORIYA,2004,husband forced wife to apologize always,Medium
2296,CHHATTISGARH,MAHASAMUND,2004,wife denied her own savings,Medium
2297,CHHATTISGARH,NARAYANPUR,2004,husband insulted wife in front of relatives,Low
2298,CHHATTISGARH,RAIGARH,2004,wife forced to give dowry,Medium
2299,CHHATTISGARH,RAIPUR,2004,husband insulted wifes parents,Low
2300,CHHATTISGARH,RAJNANDGAON,2004,wife controlled through constant criticism,Medium
2301,CHHATTISGARH,SARGUJA,2004,husband ignored wifes needs,Medium
2302,CHHATTISGARH,TOTAL,2004,wife excluded from property matters,Medium
2303,GOA,NORTH GOA,2004,husband ridiculed wifes decisions,Medium
2304,GOA,SOUTH GOA,2004,wife denied chance to speak in meetings,Medium
2305,GOA,TOTAL,2004,husband shouted at wife during meals,Medium
2306,GUJARAT,AHMEDABAD COMMR.,2004,wife forced to handle all housework alone,Medium
2307,GUJARAT,AHMEDABAD RURAL,2004,husband insulted wife in front of neighbors,Low
2308,GUJARAT,AHWA-DANG,2004,wife silenced when asking questions,Medium
2309,GUJARAT,AMRELI,2004,husband insulted wife repeatedly about money,Low
2310,GUJARAT,ANAND,2004,wife denied support during pregnancy,Medium
2311,GUJARAT,BHARUCH,2004,husband insulted wife about her looks,Low
2312,GUJARAT,BHAVNAGAR,2004,wife excluded from family functions,Medium
2313,GUJARAT,DAHOD,2004,husband controlled wifes earnings,Medium
2314,GUJARAT,GANDHINAGAR,2004,wife humiliated over small mistakes,Medium
2315,GUJARAT,HIMATNAGAR,2004,husband insulted wife about her clothes,Low
2316,GUJARAT,JAMNAGAR,2004,wife excluded from discussions,Medium
2317,GUJARAT,JUNAGADH,2004,husband ridiculed wife in front of friends,Medium
2318,GUJARAT,KHEDA NORTH,2004,wife silenced by constant shouting,Medium
2319,GUJARAT,KUTCH,2004,husband insulted wifes cooking daily,Low
2320,GUJARAT,MEHSANA,2004,wife denied her own choices,Medium
2321,GUJARAT,NARMADA,2004,husband insulted wifes education level,Low
2322,GUJARAT,NAVSARI,2004,wife humiliated in public gatherings,Medium
2323,GUJARAT,PALANPUR,2004,husband forced wife to leave friends,Medium
2324,GUJARAT,PANCHMAHAL,2004,wife denied emotional support,Medium
2325,GUJARAT,PATAN,2004,husband insulted wife without any cause,Low
2326,GUJARAT,PORBANDAR,2004,wife excluded from social circles,Medium
2327,GUJARAT,RAJKOT COMMR.,2004,husband insulted wife for not obeying,Low
2328,GUJARAT,RAJKOT RURAL,2004,wife silenced in every argument,Low
2329,GUJARAT,SURAT COMMR.,2004,husband insulted wife harshly at home,Low
2330,GUJARAT,SURAT RURAL,2004,wife denied respect from husband,Medium
2331,GUJARAT,SURENDRANAGAR,2004,husband insulted wife during festivals,Low
2332,GUJARAT,VADODARA COMMR.,2004,wife humiliated in front of husbands family,Medium
2333,GUJARAT,VADODARA RURAL,2004,husband insulted wifes personality,Low
2334,GUJARAT,VALSAD,2004,wife excluded from conversations,Medium
2335,GUJARAT,W.RLY,2004,husband insulted wife constantly at work events,Low
2336,GUJARAT,TOTAL,2004,wife denied her happiness,Medium
2337,HARYANA,AMBALA,2004,husband insulted wife in front of children,Low
2338,HARYANA,BHIWANI,2004,wife treated like property by husband,Medium
2339,HARYANA,FARIDABAD,2004,husband insulted wifes hairstyle,Low
2340,HARYANA,FATEHABAD,2004,wife denied peace at home,Medium
2341,HARYANA,GRP,2004,husband insulted wife in community events,Low
2342,HARYANA,GURGAON,2004,wife forced to accept insults silently,Medium
2343,HARYANA,HISSAR,2004,husband insulted wife when drunk,Low
2344,HARYANA,JHAJJAR,2004,wife excluded from financial decisions,Medium
2345,HARYANA,JIND,2004,husband insulted wife every day,Low
2346,HARYANA,KAITHAL,2004,wife denied her right to relax,Medium
2347,HARYANA,KARNAL,2004,husband insulted wife in gatherings daily,Low
2348,HARYANA,KURUKSHETRA,2004,wife humiliated during ceremonies,Medium
2349,HARYANA,MAHENDRAGARH,2004,husband insulted wifes intelligence,Low
2350,HARYANA,PANCHKULA,2004,wife excluded from joyful events,Medium
2351,HARYANA,PANIPAT,2004,husband insulted wife cruelly in front of others,Low
2352,HARYANA,REWARI,2004,wife denied fair treatment,Medium
2353,HARYANA,ROHTAK,2004,husband insulted wife again and again,Low
2354,HARYANA,SIRSA,2004,wife silenced with harsh words,Medium
2355,HARYANA,SONIPAT,2004,husband insulted wife endlessly,Low
2356,HARYANA,YAMUNANAGAR,2004,wife insulted unfairly by husband,Low
2357,HARYANA,TOTAL,2004,husband insulted wife with cruel remarks,Low
2358,HIMACHAL PRADESH,BILASPUR,2004,wife excluded from family outings often,Medium
2359,HIMACHAL PRADESH,CHAMBA,2004,husband insulted wife bitterly,Low
2360,HIMACHAL PRADESH,G.R.P.,2004,wife treated with contempt by husband,Medium
2361,HIMACHAL PRADESH,HAMIRPUR,2004,husband insulted wife during meals regularly,Low
2362,HIMACHAL PRADESH,KANGRA,2004,wife humiliated in private,Medium
2363,HIMACHAL PRADESH,KINNAUR,2004,husband insulted wife when angry daily,Low
2364,HIMACHAL PRADESH,KULLU,2004,wife excluded from decision making always,Medium
2365,HIMACHAL PRADESH,LAHAUL-SPITI,2004,husband insulted wife over small issues daily,Low
2366,HIMACHAL PRADESH,MANDI,2004,wife silenced in private arguments,Low
2367,HIMACHAL PRADESH,SHIMLA,2004,husband insulted wife in front of guests daily,Low
2368,HIMACHAL PRADESH,SIRMAUR,2004,wife humiliated harshly,Medium
2369,HIMACHAL PRADESH,SOLAN,2004,husband insulted wife continuously,Low
2370,HIMACHAL PRADESH,UNA,2004,wife denied comfort in marriage,Medium
2371,HIMACHAL PRADESH,TOTAL,2004,husband insulted wifes appearance regularly,Low
2372,JAMMU & KASHMIR,ANANTNAG,2004,wife excluded from happy moments,Medium
2373,JAMMU & KASHMIR,AWANTIPORA,2004,husband insulted wife frequently at home,Low
2374,JAMMU & KASHMIR,BARAMULLA,2004,wife humiliated during discussions,Medium
2375,JAMMU & KASHMIR,BORDER,2004,husband insulted wife harshly daily,Low
2376,JAMMU & KASHMIR,BUDGAM,2004,wife excluded from choices in family life,Medium
2377,JAMMU & KASHMIR,CRIME JAMMU,2004,husband insulted wife with loud shouting,Low
2378,JAMMU & KASHMIR,CRIME SRINAGAR,2004,wife humiliated in gatherings daily,Medium
2379,JAMMU & KASHMIR,DODA,2004,husband insulted wife cruelly at events,Low
2380,JAMMU & KASHMIR,GANDERBAL,2004,wife excluded from celebrations always,Medium
2381,JAMMU & KASHMIR,HANDWARA,2004,husband insulted wife bitterly at home,Low
2382,JAMMU & KASHMIR,JAMMU,2004,wife humiliated with constant yelling,Medium
2383,JAMMU & KASHMIR,KARGIL,2004,husband insulted wife harshly at functions,Low
2384,JAMMU & KASHMIR,KATHUA,2004,wife denied her rest constantly,Medium
2385,JAMMU & KASHMIR,KULGAM,2004,husband insulted wife mercilessly,Low
2386,JAMMU & KASHMIR,KUPWARA,2004,wife excluded from home decisions always,Medium
2387,JAMMU & KASHMIR,LEH,2004,husband insulted wife severely,Low
2388,JAMMU & KASHMIR,POONCH,2004,wife humiliated in family dinners,Medium
2389,JAMMU & KASHMIR,PULWAMA,2004,husband insulted wife repeatedly in public,Low
2390,JAMMU & KASHMIR,RAILWAYS,2004,wife denied kindness from husband,Medium
2391,JAMMU & KASHMIR,RAJOURI,2004,husband insulted wife harshly in front of kids,Low
2392,JAMMU & KASHMIR,RAMBAN,2004,wife excluded from outings often,Medium
2393,JAMMU & KASHMIR,REASI,2004,husband insulted wife daily in community,Low
2394,JAMMU & KASHMIR,SRINAGAR,2004,wife humiliated at neighborhood events,Medium
2395,JAMMU & KASHMIR,UDHAMPUR,2004,husband insulted wife unfairly every day,Low
2396,JAMMU & KASHMIR,TOTAL,2004,wife excluded from important talks,Medium
2397,JHARKHAND,BOKARO,2004,husband insulted wife brutally,Low
2398,JHARKHAND,CHAIBASA,2004,wife humiliated in front of in-laws constantly,Medium
2399,JHARKHAND,CHATRA,2004,husband insulted wife violently with words,Low
2400,JHARKHAND,DEOGHAR,2004,wife excluded from gatherings repeatedly,Medium
2401,JHARKHAND,DHANBAD,2004,husband insulted wife savagely,Low
2402,JHARKHAND,DHANBAD RLY.,2004,wife humiliated with strong insults,Medium
2403,JHARKHAND,DUMKA,2004,husband insulted wife with anger always,Low
2404,JHARKHAND,GARHWA,2004,wife excluded from social occasions,Medium
2405,JHARKHAND,GIRIDIH,2004,husband insulted wife repeatedly at meals,Low
2406,JHARKHAND,GODDA,2004,wife humiliated endlessly,Medium
2407,JHARKHAND,GUMLA,2004,husband insulted wife with cruel words daily,Low
2408,JHARKHAND,HAZARIBAGH,2004,wife excluded from family decisions regularly,Medium
2409,JHARKHAND,JAMSHEDPUR,2004,husband insulted wife daily at home,Low
2410,JHARKHAND,JAMSHEDPUR RLY.,2004,wife humiliated in public constantly,Medium
2411,JHARKHAND,JAMTARA,2004,husband insulted wife unfairly in private,Low
2412,JHARKHAND,KODERMA,2004,wife excluded from joyful times,Medium
2413,JHARKHAND,LATEHAR,2004,husband insulted wife harshly every day,Low
2414,JHARKHAND,LOHARDAGGA,2004,wife humiliated repeatedly at functions,Medium
2415,JHARKHAND,PAKUR,2004,husband insulted wife during events daily,Low
2416,JHARKHAND,PALAMU,2004,wife denied freedom of opinion,Medium
2417,JHARKHAND,RANCHI,2004,husband insulted wife endlessly at gatherings,Low
2418,JHARKHAND,SAHEBGANJ,2004,wife humiliated in front of neighbors daily,Medium
2419,JHARKHAND,SARAIKELA,2004,husband insulted wife with insults daily,Low
2420,JHARKHAND,SIMDEGA,2004,wife excluded from choices constantly,Medium
2421,JHARKHAND,TOTAL,2004,husband insulted wife every morning,Low
2422,KARNATAKA,BAGALKOT,2004,wife humiliated at breakfast,Medium
2423,KARNATAKA,BANGALORE COMMR.,2004,husband insulted wife before sleeping,Low
2424,KARNATAKA,BANGALORE RURAL,2004,wife excluded from evening talks,Medium
2425,KARNATAKA,BELGAUM,2004,husband insulted wife during arguments constantly,Low
2426,KARNATAKA,BELLARY,2004,wife humiliated with unfair words,Medium
2427,KARNATAKA,BIDAR,2004,husband insulted wife harshly in front of friends,Low
2428,KARNATAKA,BIJAPUR,2004,wife excluded from personal choices,Medium
2429,KARNATAKA,CHAMARAJNAGAR,2004,husband insulted wife daily in gatherings,Low
2430,KARNATAKA,CHICKMAGALUR,2004,wife humiliated without reason,Medium
2431,KARNATAKA,CHITRADURGA,2004,husband insulted wife cruelly at home,Low
2432,KARNATAKA,DAKSHIN KANNADA,2004,wife excluded from family planning,Medium
2433,KARNATAKA,DAVANAGERE,2004,husband insulted wife with abusive words,Low
2434,KARNATAKA,DHARWAD COMMR.,2004,wife humiliated constantly in public,Medium
2435,KARNATAKA,DHARWAD RURAL,2004,husband insulted wife again during meals,Low
2436,KARNATAKA,GADAG,2004,wife excluded from decisions in home matters,Medium
2437,KARNATAKA,GULBARGA,2004,husband insulted wife daily in private,Low
2438,KARNATAKA,HASSAN,2004,wife humiliated harshly every day,Medium
2439,KARNATAKA,HAVERI,2004,husband insulted wife mercilessly in public,Low
2440,KARNATAKA,K.G.F.,2004,wife excluded from respect at home,Medium
2441,KARNATAKA,KODAGU,2004,husband insulted wife cruelly every day,Low
2442,KARNATAKA,KOLAR,2004,wife humiliated in front of relatives daily,Medium
2443,KARNATAKA,KOPPAL,2004,husband insulted wife harshly in gatherings,Low
2444,KARNATAKA,MANDYA,2004,wife excluded from happiness daily,Medium
2445,KARNATAKA,MYSORE COMMR.,2004,husband insulted wife in front of guests always,Low
2446,KARNATAKA,MYSORE RURAL,2004,wife humiliated again and again,Medium
